{
  "architecture_patterns": [
    {
      "mapping": "Create a small root atlas, link child maps by subsystem boundary, and regenerate reports in CI.",
      "name": "Map-of-maps for huge repositories",
      "redaction": "Publish path-level maps, sanitized contracts, and review hints.",
      "works_for": "Monorepos, kernels, platform repos, multi-language systems"
    },
    {
      "mapping": "Run atlas scan/build in CI, diff the generated report, and route changed subsystem maps to reviewers.",
      "name": "Merge-time system drift check",
      "redaction": "Keep private data and secrets out of manifests; expose interfaces only.",
      "works_for": "Projects that want architecture reports on every merge"
    }
  ],
  "artifacts": [
    {
      "artifact_id": "arch_child_map",
      "kind": "child_system_map",
      "name": "arch/ Child System Map",
      "owner": "unknown",
      "path": "subsystems/arch/system_review_manifest.json",
      "purpose": "Machine-readable child map for a top-level subsystem boundary.",
      "redaction": "safe_to_share",
      "schema": "SubsystemMap"
    },
    {
      "artifact_id": "block_child_map",
      "kind": "child_system_map",
      "name": "block/ Child System Map",
      "owner": "unknown",
      "path": "subsystems/block/system_review_manifest.json",
      "purpose": "Machine-readable child map for a top-level subsystem boundary.",
      "redaction": "safe_to_share",
      "schema": "SubsystemMap"
    },
    {
      "artifact_id": "certs_child_map",
      "kind": "child_system_map",
      "name": "certs/ Child System Map",
      "owner": "unknown",
      "path": "subsystems/certs/system_review_manifest.json",
      "purpose": "Machine-readable child map for a top-level subsystem boundary.",
      "redaction": "safe_to_share",
      "schema": "SubsystemMap"
    },
    {
      "artifact_id": "crypto_child_map",
      "kind": "child_system_map",
      "name": "crypto/ Child System Map",
      "owner": "unknown",
      "path": "subsystems/crypto/system_review_manifest.json",
      "purpose": "Machine-readable child map for a top-level subsystem boundary.",
      "redaction": "safe_to_share",
      "schema": "SubsystemMap"
    },
    {
      "artifact_id": "documentation_child_map",
      "kind": "child_system_map",
      "name": "Documentation/ Child System Map",
      "owner": "unknown",
      "path": "subsystems/documentation/system_review_manifest.json",
      "purpose": "Machine-readable child map for a top-level subsystem boundary.",
      "redaction": "safe_to_share",
      "schema": "SubsystemMap"
    },
    {
      "artifact_id": "drivers_child_map",
      "kind": "child_system_map",
      "name": "drivers/ Child System Map",
      "owner": "unknown",
      "path": "subsystems/drivers/system_review_manifest.json",
      "purpose": "Machine-readable child map for a top-level subsystem boundary.",
      "redaction": "safe_to_share",
      "schema": "SubsystemMap"
    },
    {
      "artifact_id": "fs_child_map",
      "kind": "child_system_map",
      "name": "fs/ Child System Map",
      "owner": "unknown",
      "path": "subsystems/fs/system_review_manifest.json",
      "purpose": "Machine-readable child map for a top-level subsystem boundary.",
      "redaction": "safe_to_share",
      "schema": "SubsystemMap"
    },
    {
      "artifact_id": "include_child_map",
      "kind": "child_system_map",
      "name": "include/ Child System Map",
      "owner": "unknown",
      "path": "subsystems/include/system_review_manifest.json",
      "purpose": "Machine-readable child map for a top-level subsystem boundary.",
      "redaction": "safe_to_share",
      "schema": "SubsystemMap"
    },
    {
      "artifact_id": "init_child_map",
      "kind": "child_system_map",
      "name": "init/ Child System Map",
      "owner": "unknown",
      "path": "subsystems/init/system_review_manifest.json",
      "purpose": "Machine-readable child map for a top-level subsystem boundary.",
      "redaction": "safe_to_share",
      "schema": "SubsystemMap"
    },
    {
      "artifact_id": "io_uring_child_map",
      "kind": "child_system_map",
      "name": "io_uring/ Child System Map",
      "owner": "unknown",
      "path": "subsystems/io_uring/system_review_manifest.json",
      "purpose": "Machine-readable child map for a top-level subsystem boundary.",
      "redaction": "safe_to_share",
      "schema": "SubsystemMap"
    },
    {
      "artifact_id": "ipc_child_map",
      "kind": "child_system_map",
      "name": "ipc/ Child System Map",
      "owner": "unknown",
      "path": "subsystems/ipc/system_review_manifest.json",
      "purpose": "Machine-readable child map for a top-level subsystem boundary.",
      "redaction": "safe_to_share",
      "schema": "SubsystemMap"
    },
    {
      "artifact_id": "kernel_child_map",
      "kind": "child_system_map",
      "name": "kernel/ Child System Map",
      "owner": "unknown",
      "path": "subsystems/kernel/system_review_manifest.json",
      "purpose": "Machine-readable child map for a top-level subsystem boundary.",
      "redaction": "safe_to_share",
      "schema": "SubsystemMap"
    },
    {
      "artifact_id": "lib_child_map",
      "kind": "child_system_map",
      "name": "lib/ Child System Map",
      "owner": "unknown",
      "path": "subsystems/lib/system_review_manifest.json",
      "purpose": "Machine-readable child map for a top-level subsystem boundary.",
      "redaction": "safe_to_share",
      "schema": "SubsystemMap"
    },
    {
      "artifact_id": "mm_child_map",
      "kind": "child_system_map",
      "name": "mm/ Child System Map",
      "owner": "unknown",
      "path": "subsystems/mm/system_review_manifest.json",
      "purpose": "Machine-readable child map for a top-level subsystem boundary.",
      "redaction": "safe_to_share",
      "schema": "SubsystemMap"
    },
    {
      "artifact_id": "net_child_map",
      "kind": "child_system_map",
      "name": "net/ Child System Map",
      "owner": "unknown",
      "path": "subsystems/net/system_review_manifest.json",
      "purpose": "Machine-readable child map for a top-level subsystem boundary.",
      "redaction": "safe_to_share",
      "schema": "SubsystemMap"
    },
    {
      "artifact_id": "rust_child_map",
      "kind": "child_system_map",
      "name": "rust/ Child System Map",
      "owner": "unknown",
      "path": "subsystems/rust/system_review_manifest.json",
      "purpose": "Machine-readable child map for a top-level subsystem boundary.",
      "redaction": "safe_to_share",
      "schema": "SubsystemMap"
    },
    {
      "artifact_id": "samples_child_map",
      "kind": "child_system_map",
      "name": "samples/ Child System Map",
      "owner": "unknown",
      "path": "subsystems/samples/system_review_manifest.json",
      "purpose": "Machine-readable child map for a top-level subsystem boundary.",
      "redaction": "safe_to_share",
      "schema": "SubsystemMap"
    },
    {
      "artifact_id": "scripts_child_map",
      "kind": "child_system_map",
      "name": "scripts/ Child System Map",
      "owner": "unknown",
      "path": "subsystems/scripts/system_review_manifest.json",
      "purpose": "Machine-readable child map for a top-level subsystem boundary.",
      "redaction": "safe_to_share",
      "schema": "SubsystemMap"
    },
    {
      "artifact_id": "security_child_map",
      "kind": "child_system_map",
      "name": "security/ Child System Map",
      "owner": "unknown",
      "path": "subsystems/security/system_review_manifest.json",
      "purpose": "Machine-readable child map for a top-level subsystem boundary.",
      "redaction": "safe_to_share",
      "schema": "SubsystemMap"
    },
    {
      "artifact_id": "sound_child_map",
      "kind": "child_system_map",
      "name": "sound/ Child System Map",
      "owner": "unknown",
      "path": "subsystems/sound/system_review_manifest.json",
      "purpose": "Machine-readable child map for a top-level subsystem boundary.",
      "redaction": "safe_to_share",
      "schema": "SubsystemMap"
    },
    {
      "artifact_id": "tools_child_map",
      "kind": "child_system_map",
      "name": "tools/ Child System Map",
      "owner": "unknown",
      "path": "subsystems/tools/system_review_manifest.json",
      "purpose": "Machine-readable child map for a top-level subsystem boundary.",
      "redaction": "safe_to_share",
      "schema": "SubsystemMap"
    },
    {
      "artifact_id": "usr_child_map",
      "kind": "child_system_map",
      "name": "usr/ Child System Map",
      "owner": "unknown",
      "path": "subsystems/usr/system_review_manifest.json",
      "purpose": "Machine-readable child map for a top-level subsystem boundary.",
      "redaction": "safe_to_share",
      "schema": "SubsystemMap"
    },
    {
      "artifact_id": "virt_child_map",
      "kind": "child_system_map",
      "name": "virt/ Child System Map",
      "owner": "unknown",
      "path": "subsystems/virt/system_review_manifest.json",
      "purpose": "Machine-readable child map for a top-level subsystem boundary.",
      "redaction": "safe_to_share",
      "schema": "SubsystemMap"
    },
    {
      "artifact_id": "licenses_child_map",
      "kind": "child_system_map",
      "name": "LICENSES/ Child System Map",
      "owner": "unknown",
      "path": "subsystems/licenses/system_review_manifest.json",
      "purpose": "Machine-readable child map for a top-level subsystem boundary.",
      "redaction": "safe_to_share",
      "schema": "SubsystemMap"
    }
  ],
  "bigger_picture": "This is a large-repository map-of-maps stress test for System Review Graph. It uses real Linux kernel tracked paths to create a root atlas and child subsystem maps. The example is useful for orientation, CI drift checks, and reviewer routing, but it is not an official Linux maintainer audit and does not prove runtime behavior.",
  "child_maps": [
    {
      "map_id": "arch",